{
  "id": "SEG-FIX-1",
  "version": 1,
  "market_model_id": "MKT-FIX-1",
  "time_context": [
    "繁忙期直後の見直し局面"
  ],
  "space_context": [
    "自宅・モバイル検索"
  ],
  "progress_state": "代替手段を比較検討中",
  "trigger_events": [
    "既存手段の失敗体験"
  ],
  "constraints": [
    "月予算 5,000 円以内",
    "平日夜のみ可処分時間"
  ],
  "alternative_behaviors": [
    "スプレッドシートで手動管理"
  ],
  "decision_conditions": [
    "無料で試せる",
    "導入 1 日以内"
  ],
  "non_target_conditions": [
    "代理店運用前提の企業"
  ],
  "evidence_ids": [
    "OBS-FIX-1"
  ],
  "confidence": 0.6,
  "status": "draft",
  "supersedes_id": null
}
